question,answer
"Which of these vehicles must always stop before crossing railroad tracks?
 
Tank trucks marked with hazardous materials placards.

Motor homes or pickup trucks towing a boat trailer.

Any vehicle with three or more axles and weighing more than 4,000 pounds.Tank trucks marked with hazardous materials placards.",Tank trucks marked with hazardous materials placards.
"Water on the road can cause a vehicle to hydroplane. Your car may hydroplane at speeds as low as:
 
45 miles per hour.

35 miles per hour.

40 miles per hour.35 miles per hour.",35 miles per hour.
"When entering the interstate, check for a gap in traffic in the nearest lane, adjust your speed to match traffic, signal, and:
 
Expect traffic to allow you to proceed into the lane, since you have the right-of-way.

Merge carefully into the gap.

Wait for the lane to clear before merging.Merge carefully into the gap.",Merge carefully into the gap.
"When using a roundabout, drivers should:
 
Stop in the middle of the roundabout.

Yield to traffic already in the roundabout.

Yield to entering traffic.Yield to traffic already in the roundabout.",Yield to traffic already in the roundabout.
"Extra space in front of a large truck is needed for:
 
Other drivers to merge onto the freeway.

The truck driver to stop the vehicle.

Other drivers when they want to slow down.The truck driver to stop the vehicle.",The truck driver to stop the vehicle.
"If you are being followed too closely on a two-lane road:
 
Reduce your speed slowly to encourage the tailgater to drive around you.

Speed up to increase the distance between you and the other car.

Apply your brakes to slow down, then resume your original speed.Reduce your speed slowly to encourage the tailgater to drive around you.",Reduce your speed slowly to encourage the tailgater to drive around you.
"A flashing yellow traffic signal at an intersection means:
 
You should treat the signal like a stop sign.

Stop. Yield to all cross traffic before crossing in the intersection.

Slow down and be alert at the upcoming intersection.Slow down and be alert at the upcoming intersection.",Slow down and be alert at the upcoming intersection.
"You want to turn left at an upcoming corner. Yield the right-of-way to:
 
Oncoming vehicles also turning left.

All approaching vehicles.

Pedestrians on the sidewalk waiting for a ""Walk"" signal.All approaching vehicles",All approaching vehicles
"When parking uphill on a two-way street with no curb, your front wheels should be:
 
Turned to the left (toward the street).

Turned to the right (away from the street).

Parallel with the pavement.Turned to the right (away from the street).",Turned to the right (away from the street).
"The vertical rectangular traffic sign typically gives

a route number

a warning about the condition of the road

instructions to the driver

directions to the driver to stopinstructions to the driver",instructions to the driver
"Two or more DUI convictions in the state of California may result in up to ___ years of license revocation.

5 

3 

25",5
"On a two-lane undivided highway, the maximum speed limit for vehicles towing trailers is ________ mph unless otherwise posted.

55

60

6555",55
